{
  "id": "content.legal-header",
  "name": "Legal page header",
  "category": "content",
  "semantic": {
    "id": "content.legal-header",
    "category": "LEGAL"
  },
  "source": {
    "id": "PrivacyPolicy>article>h1",
    "tag": "h1",
    "file": "src/pages/PrivacyPolicy.jsx",
    "lines": "46"
  },
  "retrievalEligible": true,
  "purpose": "Opening of a legal page: the large page headline plus the preamble paragraph that precedes the first numbered part.",
  "evidenceLevel": "measured",
  "implementedBy": "src/pages/PrivacyPolicy.jsx",
  "surface": "transparent",
  "scrollStage": false,
  "ambientVideoCount": 0,
  "anchor": null,
  "variants": null,
  "content": {
    "type": "object",
    "additionalProperties": false,
    "required": [
      "heading"
    ],
    "properties": {
      "heading": {
        "type": "string",
        "minLength": 1,
        "x-maxWords": 4
      },
      "intro": {
        "type": "array",
        "minItems": 1,
        "maxItems": 2,
        "items": {
          "type": "string",
          "minLength": 1,
          "x-maxWords": 90
        }
      }
    }
  },
  "constraints": {
    "maxPerPage": 1,
    "templates": [
      "template.legal-prose"
    ]
  },
  "generatedAssetRoles": [],
  "motion": {
    "pattern": "none",
    "trigger": "none",
    "reducedMotionFallback": "none",
    "distinctive": false,
    "fallbackIsPrescriptive": true,
    "timings": {},
    "evidence": []
  },
  "responsive": {
    "primaryBreakpoint": 768,
    "changes": [
      {
        "maxWidth": 768,
        "aspect": "layout",
        "desktop": "12-col grid, body col 1/span 7, padding 400px/200px",
        "mobile": "flex column, gap 40px, padding 190px/120px",
        "evidence": {
          "path": "src/index.css",
          "lines": "692-696",
          "quote": "padding: 190px var(--margin-page) 120px"
        }
      }
    ]
  },
  "evidence": [
    {
      "path": "src/pages/PrivacyPolicy.jsx",
      "lines": "45-46",
      "quote": "<h1 className=\"text-headline1\">Privacy Policy</h1>"
    },
    {
      "path": "src/lib/privacyBody.js",
      "lines": "2",
      "quote": "<p>This Privacy Policy presents the process of collecting"
    },
    {
      "path": "CLONE_SPEC.md",
      "lines": "496-508",
      "quote": "`h1.textHeadline1` \"Privacy Policy\" (`grid-column:span 12`): x50 y400, 96px."
    }
  ],
  "fixtures": {
    "default": {
      "content": {
        "heading": "Privacy Policy",
        "intro": [
          "This page explains how personal data is collected and used."
        ]
      }
    }
  },
  "notes": "Decomposed from the former whole-article content.legal-prose (R6): the article measured 3476px of a 4423px page (79%). This unit runs from the article top (400px padding + 96px h1) to the first part heading; measured 740.4px at 1440. The page surface (oat) is painted by the page wrapper, not by this section, hence surface transparent. Do not copy the source policy text."
}
